Title,Organization,Author,Date,URL,Summary,Tags,Language,Other title 1,Other org 1,Other author 1,Other date 1,Other URL 1,Other title 2,Other org 2,Other author 2,Other date 2,Other URL 2,Other title 3,Other org 3,Other author 3,Other date 3,Other URL 3
Teaching Institute or Dance Bar? Putting Local Freedom of Information Legislation to Use in Argentina,Freedominfo.org,Martha Farmelo,4/15/05,http://www.freedominfo.org/2005/04/case-study-teaching-institute-or-dance-bar/,"In this article, the author explains her ordeal with filing a complaint against a noisy bar across the street from her residence in Buenos Aires. Nothing happened. Next, an inquiry to the bar's operating license was filed under the city's 1998 acces to information law. The city said the bar was a ""teaching institute, techinal institute [or] academy."" Just days after the city's reply, a fire broke out in a different dance club, República Cromañón, killing 193 people. Seizing the opportunity for reform, the author's partner wrote to the Clarin, a widely-read daily publication. His letter to the editor highlighted the public safety implications of corruption and championed democratic efforts to get involved in regulating license verification. The ensuing media attention promped the city government to crack down on bars and safety regulations, but the story stands as a testament to how freedom of information laws can actually help government be more effective through citizen engagement.","Public Safety, Citizen Engagement, Anti-Corruption",English,N/A,N/A,N/A,N/A,N/A,N/A,N/A,N/A,N/A,N/A,N/A,N/A,N/A,N/A,N/A
The Freedom of Information Campaign in Argentina [excerpt],Freedominfo.org,Martha Farmelo,10/14/03,http://www.freedominfo.org/wp-content/uploads/documents/farmelo.pdf,"This article mostly focuses on the history and process of passing national laws. However, some anecdotes on information requests and why they are important are included. The first describes a situation in which a public hospital stopped giving medicine to transplant patients for unexplained reasons. To find out why, patients used the city's FOI law to demand an explanation from the hospital. Multiple requests surfaced evidence that the hospital was low on funds, giving the patients the necessary information to obtain their medicine through the legal system. The second is the story of journalist Sandra Crucianelli, who was involved with an information request to the city of Bahia Blanca regarding water quality, using the Buenos Aires province's FOI law (weaker than the city's). The request was turned down as the information was perceived as potentially harmful to the reputation of local companies, who were suspected of contaminating the supply. The third is about one of the country's leading environmental groups, Fundación Ambiente y Recursos Naturales (Environment and Natural Resources Foundation, FARN), who represented a Buenos Aires city resident concerned about the construction of a rainfall reservoir in his neighborhood. Under Law 104, he was able to see environmental impact reports on the project from the city government for himself, empowering him to learn about its effects on his home.","Public Health, Legal Standards, Anti-Corruption, Environment",English,N/A,N/A,N/A,N/A,N/A,N/A,N/A,N/A,N/A,N/A,N/A,N/A,N/A,N/A,N/A
Pocos datos sobre Aerolíneas Argentinas,Chequeado,Olivia Sohr,1/11/11,http://chequeado.com/el-explicador/pocos-datos-sobre-aerolineas-argentinas/,"A state entreprise and recipient of state money, Aerolineas Argentina (AA) does not publically provide a summary of financial balances on their website. When Chequeado, an Argentine website for fact-checking, called in a request for that information, they were turned away. AA's answer was that although the info was supposed to be public, it could not be provided at the time. As a result, we still do not know where state money to AA went, or how much. Perhaps it could be understandable that finances from the previous year, 2010, may have not been ready yet, but even those from the year before that were inaccessible. Although some may point to AA's transition and ambiguous status as an excuse, AA has been managed by the state since 2008. Furthermore, many public/state and private companies around the world do provide this information on websites. This information is important to citizens who finance the company through their taxes — as such, they have the right to know how their money is being used, especially in the case of publically subsidized businesses.","Anti-Corruption, Finance, State Enterprise",Spanish,N/A,N/A,N/A,N/A,N/A,N/A,N/A,N/A,N/A,N/A,N/A,N/A,N/A,N/A,N/A
Las respuestas a los pedidos de acceso por la base china en Neuquén,Chequeado,Not listed,2/25/15,http://chequeado.com/hilando-fino/las-respuestas-a-los-pedidos-de-acceso-por-la-base-china-en-neuquen/,"In 2012, China signed two cooperative agreements with Argentina — one with Argentina's National Space Activities Commission (CONAE) and one with the province of Neuquén — for contruction of a satellite space station to ""support activities related to interplanetary exploration, astronomical observation, monitoring and control of satellites in orbit and data acquisition."" The agreement stipulates China's lease on and use of this station for 50 years in exchange for CONAE's lmited access to it. The Senate gave preliminary approval to a bill that supports the project, which will be finalized in 2016. Chequado asked Argentina's Ministry of Foreign Affairs and Worship for access to this agreement. Because there were criticisms and suspicions regarding the reason for the station linking it to possible military use, this information was deemed important to the public interest. On orders from the Ministry of Foreign Affairs and Worship, Argentina's National Space Activities Commission (CONAE) responded by releasing the the full copy of the agreement, complete with all clauses and annexes, here: http://www.scribd.com/doc/256407065/Acuerdo-Argentina-China. According to the document, there appear to be no clauses related to ambiguous uses of the station.","Military, Foreign Affairs",Spanish,Cinco puntos para entender la estación espacial china en Neuquén,Chequeado,Matías Di Santi and Ariel Riera,2/10/15,http://chequeado.com/el-explicador/cinco-puntos-para-entender-la-estacion-espacial-china-en-neuquen/,N/A,N/A,N/A,N/A,N/A,N/A,N/A,N/A,N/A,N/A
YPF – Chevron: contrato secreto e investigación presidencial,Chequeado,Olivia Sohr,5/14/14,http://chequeado.com/hilando-fino/ypf-chevron-contrato-secreto-e-investigacion-presidencial/,"The Supreme Court ordered an investigation into President Kirchner's signing of a contract between YPF (Argentina's energy company) and Chevron given concerns over a conflict of interest and abuse of power. Chequeado made a request for access to information about the contract under Decree 1172/03. YPF answered by denying access to the information on the grounds of being a ""publically held company"" that has ""securities in the capital market,"" leaving it outside the scope of the Decree's jurisdiction. However, this argument has been called into question given that the law applies to private companies that receive public funding, as is the case of YPF.","State Enterpise, Anti-Corruption, Finance",Spanish,N/A,N/A,N/A,N/A,N/A,N/A,N/A,N/A,N/A,N/A,N/A,N/A,N/A,N/A,N/A
¿CFK no tiene título de abogada?,Chequeado,Ariel Riera,11/12/14,http://chequeado.com/ultimas-noticias/icfk-no-tiene-titulo-de-abogada/,"There has been a lot of commotion surrounding the President’s law degree and whether she actually has one or not. Chequeado made a request to receive a copy under Decree 1172/03. On December 5, 2014, Chequeado received a response from the Secretary General of the Presidency dated November 25th stating that a copy cannot be given as it contains “personal information” (Law 25.326). This same statue was cited by the Ministry of Social Development to the Center for the Implementation of Public Policies Promoting Equity and Growth (CIPPEC) over information on beneficiaries of social plans. However, that request involved information from private citizens, whereas the position of President is not covered by the same protections.","Public Officials, Personal Information and privacy",Spanish,N/A,N/A,N/A,N/A,N/A,N/A,N/A,N/A,N/A,N/A,N/A,N/A,N/A,N/A,N/A
Capitanich: “En este teléfono no hay ningún llamado del gobernador José Manuel De la Sota”,Chequeado,Laura Zommer,2/3/14,http://chequeado.com/ultimas-noticias/jorge-capitanich-jefe-de-gabinete-de-la-nacion-qen-este-telefono-no-hay-ningun-llamado-del-gobernador-jose-manuel-de-la-sotaq/,"On December 20, 2013, Chequeado, along with La Voz Interior de Cordoba, a newspaper, made a request for communications between the Chief of the Cabinet of Ministers and the Ministry of Homeland Security during protests in the province on December 3-4 to confirm whether or not the provincial government asked for assistance from the national government. La Voz had previously requested the same information from the provincial Ministry of Communication and Development. They were sent responses detailing communication attempts between officials during the protests, helping journalists unravel how Homeland Security Act No. 24.059 — the law that allows for such requests for assistance to be made — was being used in the chaos.","Communications, Public Officials",Spanish,N/A,N/A,N/A,N/A,N/A,N/A,N/A,N/A,N/A,N/A,N/A,N/A,N/A,N/A,N/A
Making public the salaries of the President and ministers in less than 24 hours,La Nacion,Not listed,3/4/14,http://blogs.lanacion.com.ar/projects/data/journalism-and-access-to-information-how-we-got-the-government-to-inform-on-the-salary-of-the-president-and-here-ministers/,"An unnamed NGO asked for information regarding the President and public officials' wages. La Nacion composed a similar request asking for only the highest of government workers' salaries. Both requests were denied due to Argentina's sensitive data law (25.326). On February 20, 2014, La Nacion published the records of this correspondence, piling pressure on the government to release the data. Consequently, the Secretary General of the Presidency published a list of the top 20 earners in the Argentine government (http://blogs.lanacion.com.ar/projects/files/2014/04/PlanillaSueldos2012.jpg). The next day this information became front page news, revealing the power of the media to ignite change and action in government when equipped with the right tools.","Public Officials, Finance and Economy",English,N/A,N/A,N/A,N/A,N/A,N/A,N/A,N/A,N/A,N/A,N/A,N/A,N/A,N/A,N/A
Acceso al aborto legal y a la anticoncepción: pedido de informes al Ministro de Salud de Mendoza,Amnesty International,Not listed,10/2/15,http://www.amnistia.org.ar/noticias-y-documentos/archivo-de-noticias/argentina-128,"This article concerns a recent information request on behalf of numerous organizations and Amnestry International to the Minister of Health in Mendoza. It asks for data on access to contraception, legal abortion and the overall health of women, adolescents and children throughout the province. Inquiries into the matter were all prompted by César Mosso Gianini, an advisor to Mendoza's government, who published a series of opinions on the ""unconstitutionality"" and ""illegality"" of abortion. Access to such information can be helpful in determining whether public officials are following the rule of law or letting their personal opinions sway their sworn actions.","Public Health, Public Officials",Spanish,N/A,N/A,N/A,N/A,N/A,N/A,N/A,N/A,N/A,N/A,N/A,N/A,N/A,N/A,N/A
"ABORTO NO PUNIBLE. EL FALLO “F., A.L. S/ MEDIDA AUTOSATISFACTIVA”. ¿QUÉ OBTUVIMOS Y QUÉ NOS QUEDA POR OBTENER?, ",Asociación por los Derechos Civiles (ADC),Not listed,Dec-13,http://www.adc.org.ar/2013/wp-content/uploads/2013/12/Aborto-NP-protocolos-comparados-ADC-dic2013.pdf,"This is an article and a couple of reports on requests for information from Argentina's provinces on access to abortion. Many provinces did not receive any response from their Ministry of Health. In October 2012 & February 2013, the Association for Civil Rights (ADC) made requests to the provinces regarding the Program of Sexual Health and Responsibility and did not receive a response. By April 2013, only the provinces of Buenos Aires, Jujuy, Neuquen, Entre Rios, Corrientes, Missions, San Juan, Santa Cruz, and Buenos Aires (in total 9) had responded. Finally, ADC contacted Programs on Sexual Health in those provinces through email and phone between September and October 2013. Letters sent by ADC to the provinces in September 2013 were also not acknowledged. In September 2014, ADC made another round of requests to the Ministry of Public Health of each province — once again to to no avail. In February 2015, ADC called the ministries themselves, who told them that they had received a judicial notice the previous month that health providers ought to avoid administrative impediments so as to complete abortion procedures without delay. No data was received from numerous provinces, which is further detailed in the report — but the agencies' fear of open information is quite telling.",Public Health,Spanish,"Acceso al aborto no punible en Argentina: Estado de situación, Informe Acceso a la Información y Derechos en Salud Sexual y Reproductiva de las Mujeres en Argentina, Chile y Perú",Asociación por los Derechos Civiles (ADC),Not listed, 3/1/2015,http://despenalizacion.org.ar/pdf/publicaciones/ADC-Acceso-al-aborto-no-punible-Marzo-2015.pdf,"Informe Acceso a la Información y Derechos en Salud Sexual y Reproductiva de las Mujeres en Argentina, Chile y Perú",Pro Aceso Fundación,Not listed,Not listed,http://www.adc.org.ar/download.php?fileId=591,N/A,N/A,N/A,N/A,N/A
LA JUSTICIA INTIMÓ AL INDEC A INFORMAR CÓMO CALCULA LA INFLACIÓN,Asociación por los Derechos Civiles (ADC),Not listed,6/30/09,http://www.adc.org.ar/583_la-justicia-intimo-al-indec-a-informar-como-calcula-la-inflacion/,"On July 18, 2007, the Asociación por los Derechos Civiles (ADC) asked the National Statistics and Censuses Institute (INDEC) for information regarding their methodology and variables when calculating the consumer price index. ADC asked again through legal means in August 17, 2007 after INDEC did not initially respond. INDEC then responded with limited information, notably leaving out variables and not specifying their methods. In October 2008, a court ruled in favor of ADC and asked INDEC to provide the solicited information.   The data was made publicly available on INDEC’s website August 2009. This ruling represents a significant recognition of the constitutional right of every person to have access to public information held by the state.",Finance and Economy,Spanish,N/A,N/A,N/A,N/A,N/A,N/A,N/A,N/A,N/A,N/A,N/A,N/A,N/A,N/A,N/A
"ONG DEMANDARON A LA CÁMARA DE DIPUTADOS Y AL SENADO POR NO INFORMAR SOBRE EMPLEADOS, PRESUPUESTO Y SUBSIDIOS",Asociación por los Derechos Civiles (ADC),Not listed,4/6/15,http://www.adc.org.ar/ong-demandaron-a-la-camara-de-diputados-y-al-senado-por-no-informar-sobre-empleados-presupuesto-y-subsidios/,"In 2011, the Asociación Civil por la Igualdad y la Justicia (ACIJ), the Asociación por los Derechos Civiles (ADC), the Fundación Directorio Legislativo, and Poder Ciudadano requested information on employee contracts (part-time or full time), community expenses, and the grants and subsidies given to the Congressmen of the House and the Senate. In August 2014, they, along with several NGOs, once again requested this information, indicating that the information was not made available on their websites. In February 2015, after receiving no response, the NGOs filed two lawsuits suing the House and the Senate. The Administrative Court ruled in favor of ADC, ACIJ, Directorio Legislativo and Poder Ciudadano. The Senate has 15 days to respond now. The rest of the information requested was made public on the Senate website, signaligning a huge victory for civil society groups trying to bolster public engagement.","Citizen Engagement, Public Officials, Finance and Economy",Spanish, LA JUSTICIA OBLIGÓ AL SENADO A DAR INFORMACIÓN PÚBLICA SOLICITADA POR VARIAS ONG,Asociación por los Derechos Civiles (ADC),Not listed,7/24/15,http://www.adc.org.ar/la-justicia-obligo-al-senado-a-dar-informacion-publica-solicitada-por-varias-ong/,Demandan al Congreso por no brindar información pública,La Nacion,Laura Serra,4/7/15,http://www.lanacion.com.ar/1782249-demandan-al-congreso-por-no-brindar-informacion-publica,Fallo judicial señala que la información pública pertenece al pueblo y no al Estado,Poder Ciudadano,Not listed,6/20/15,http://poderciudadano.org/?p=7189
LA JUSTICIA OBLIGA A LA DIRECCIÓN DE DATOS PERSONALES A DAR INFORMACIÓN SOBRE SU FUNCIONAMIENTO,Asociación por los Derechos Civiles (ADC),Not listed,6/4/15,http://www.adc.org.ar/la-justicia-obliga-a-la-direccion-de-datos-personales-a-dar-informacion-sobre-su-funcionamiento/,"In 2013, Manuel Garrido, an Argentine deputy, requested information from the National Directorate for the Protection of Personal Data about the appointment of the department's director, but was initially denied because it was argued that deputies waived their rights to such requests once in office. The Supreme Court ruled in favor of Garrido, sponsored by the Asociación por los Derechos Civiles (ADC). This solidified the fact that being in certain positions of employment does not limit your ability to make information requests.",Public Officials,Spanish,N/A,N/A,N/A,N/A,N/A,N/A,N/A,N/A,N/A,N/A,N/A,N/A,N/A,N/A,N/A
LA CORTE BONAERENSE OBLIGA A INFORMAR LOS DÍAS SIN CLASES DE ALUMNOS SECUNDARIOS,Asociación por los Derechos Civiles (ADC),Not listed,2/6/15,http://www.adc.org.ar/la-corte-bonaerense-obliga-a-informar-los-dias-sin-clases-de-alumnos-secundarios/,"As a result of the efforts of the Asociación por los Derechos Civiles (ADC) beginning in 2007, the Supreme Court ordered the Director General of Culture and Education of the Province of Buenos Aires to release information on the amount of days no classes are taught due to the absence of teachers, specifically in 36 schools. The Director General has 15 days to respond. The request serves as yet another example of how freedom of information laws give citizens tools to evaluate how tax dollars are being spent, especially when it comes to their welfare and that of their children.",Education ,Spanish,N/A,N/A,N/A,N/A,N/A,N/A,N/A,N/A,N/A,N/A,N/A,N/A,N/A,N/A,N/A
"El derecho de acceso a la información en Argentina, un mapa",La Nacion Data,Gastón Roitberg,12/9/12,http://blogs.lanacion.com.ar/data/acceso-a-la-informacion-2/el-derecho-de-acceso-a-la-informacion-en-argentina-un-mapa/,"Although not a FOI request, this site lists Argentina's national, provincial, and local FOI laws. The following serves as a useful resource for those interested in how laws vary from jurisdiction to jurisdiction and can aid in the creation of top-level, wider-reaching laws on the subject.",Legal Standards,Spanish,N/A,N/A,N/A,N/A,N/A,N/A,N/A,N/A,N/A,N/A,N/A,N/A,N/A,N/A,N/A
El Gobierno volvió a negarse a informar el dato oficial de pobreza,La Nacion,Francisco Jueguen,10/6/15,http://www.lanacion.com.ar/1834023-el-gobierno-volvio-a-negarse-a-informar-el-dato-oficial-de-pobreza,"This article describe's the Argentine government's refusal to provide official data on poverty rates. The last official index on poverty was published in 2013, but was discontinued due to problems with how its methodology determined levels of poverty. Although Argentina's National Statistics and Censuses Institute (INDEC) stated that there are about 6000 ways to calculate poverty, nothing was ever published regarding how this could be done. When Axel Kicillof, Argentina's Minister of Economy, was asked to explain why the data was not published, he didn't address the issue, but rather answered evasively. As such, the silence raises questions on how citizens can remain engaged in awareness and action around improving the standard of living for everyone when information on its metric is kept hidden from the public.","Finance and Economy, Public Health",Spanish,N/A,N/A,N/A,N/A,N/A,N/A,N/A,N/A,N/A,N/A,N/A,N/A,N/A,N/A,N/A
Los planes sociales no deben ser un secreto,La Nacion,Pilar Arcidiácono and Mora Kantor,5/2/14,http://www.lanacion.com.ar/1686931-los-planes-sociales-no-deben-ser-un-secreto,"This article describes sitatuations in which the government denied requests for information that the Center for the Implementation of Public Policies Promoting Equity and Growth (CIPPEC) sent out, namely one that asked for a list of names and ID numbers of social plan recipients due to a violation of privacy. The article criticizes Argentina’s transparency and access to information laws, as current legal means in acquiring information are often rebuffed, resulting in incomplete responses with no justification or agencies citing privacy and “personal information” as excuses. These anecdotes are indicative of laws filled with loopholes and create momentum around bolstering the power of public information legislation.",Personal information and privacy,Spanish,N/A,N/A,N/A,N/A,N/A,N/A,N/A,N/A,N/A,N/A,N/A,N/A,N/A,N/A,N/A
Shards of Light: Freedom of information in Argentina,The Economist,H.C.,"3/27/2014, 5/30/2013, May-13",http://www.economist.com/blogs/americasview/2014/03/freedom-information-argentina,"On March 26, 2014, the Supreme Court ruled that the government must release information related to the programs administered by the ministry of social development, including lists of beneficiaries. Requests for this information have been previously rejected on the grounds that such information affects vulnerable groups. The Center for the Implementation of Public Policies Promoting Equity and Growth (CIPPEC), an Argentine think tank, had its 2007 request for this information denied. When CIPPEC requested finanicial information in the same vein from 14 state-run companies, only three sent more than half of the requested data. In a similar move, the Asociación por los Derechos Civiles (ADC) sent 49 requests to various government departments, oh which only 47% were answered satisfactorily. The Asociación Civil por la Igualdad y la Justicia (ACIJ) sought to investigate the Executive Decree's power and submitted 44 requests of info between January 2012 and 2013: 14 were not answered, 14 were answered after 10 days, and 16 were answered on time. Regarding the quality of answers, only 12 answered completely and adequately as stated in the Decree. Reports of insufficient responses to information requests are rampant, and perhaps make the case for stronger consequences in the case of shoddy replies.","Public Health, Public Officials","English, Spanish",Informes de ACIJ y ADC muestran problemas en el acceso a la información pública,La Nacion Data,Ramiro Álvarez Ugarte and María Victoria Gama,5/30/13,http://blogs.lanacion.com.ar/data/acceso-a-la-informacion-2/informes-de-acij-y-adc-muestran-problemas-en-el-acceso-a-la-informacion-publica/,Informe Sobre Acceso a la Información (Decreto 1172/03): Análisis del Escenario Actual en Materia de Transparencia en el Poder Ejecutivo Nacional,Asociación Civil por la Igualdad y la Justicia (ACIJ),Not listed,13-May,http://www.documentcloud.org/documents/705465-acij-acceso-a-la-informacion.html,N/A,N/A,N/A,N/A,N/A
ACCESO A LA INFORMACIÓN PÚBLICA: ADC PRESENTA UN AMPARO CONTRA LA JEFATURA DE GABINETE,"Asociación Civil por la Igualdad y la Justicia (ACIJ), Asociación por los Derechos Civiles (ADC)",Not listed,3/11/13,http://acij.org.ar/sin-corrupcion/2012/acceso-a-la-informacion-publica-adc-presenta-un-amparo-contra-la-jefatura-de-gabinete/,"The Asociación por los Derechos Civiles (ADC) demanded access to contracts with the production company “Pensado para Televisión” (Thinking for TV). In December 2012, journalist Mariel Fitz Patrick asked the Chief of the Cabinet of Ministers for a copy of the 2010, 2011, and 2012 contracts between this production company and Radio y Televisión Argentina SE, the public entreprise that manages the national/state media, and was turned away. The Chief responded that she would have to demonstrate a legitimate interest to have access. Furthermore, access was denied to the contracts as they included ""sensitive information."" The situation is indicative of loopholes in the procedure for responding to requests, both around the supposed privacy of certain information even when it involves public funding, and interest in the outcome of the request, which in many cases extends beyond the individual.","Personal information and privacy, State Enterprise",Spanish,ORDENAN AL ESTADO ENTREGAR CONTRATOS DE LA TV PÚBLICA,Asociación por los Derechos Civiles (ADC),Not listed,Not listed,http://www.adc.org.ar/1008_ordenan-al-estado-entregar-contratos-de-la-tv-publica/,N/A,N/A,N/A,N/A,N/A,N/A,N/A,N/A,N/A,N/A
